<?xml version="1.0" encoding="UTF-8"?>
<?xml-stylesheet href="9_table_event_winners_style.xsl" type="text/xsl"?>


<event_winners xmlns:xsi="http://www.w3.org/2001/XMLSchema-instance"
xsi:noNamespaceSchemaLocation="9_table_event_winners.xsd">
	<row>	
		<event_id>12</event_id>
		<team_id>1</team_id>
		<position>1</position>
	</row>
	<row>	
		<event_id>12</event_id>
		<team_id>2</team_id>
		<position>2</position>
	</row>
	<row>	
		<event_id>13</event_id>
		<team_id>3</team_id>
		<position>1</position>
	</row>
	<row>	
		<event_id>14</event_id>
		<team_id>4</team_id>
		<position>1</position>
	</row>
	<row>	
		<event_id>14</event_id>
		<team_id>5</team_id>
		<position>2</position>
	</row>
	<row>	
		<event_id>14</event_id>
		<team_id>6</team_id>
		<position>3</position>
	</row>
</event_winners>